{
  "$id": "line-stability-report-context.schema.json",
  "$schema": "https://json-schema.org/draft/2020-12/schema",
  "title": "Line stability report context (all fields optional)",
  "type": "object",
  "additionalProperties": false,
  "properties": {
    "data_path": {
      "type": "string",
      "description": "Production data table (CSV/TSV/XLSX/Parquet/JSON). Overridden by --data."
    },
    "line_id": {
      "type": "string",
      "maxLength": 64
    },
    "product": {
      "type": [
        "string",
        "null"
      ],
      "maxLength": 64
    },
    "time_col": {
      "type": "string"
    },
    "group_col": {
      "type": [
        "string",
        "null"
      ]
    },
    "group_filter": {
      "type": [
        "string",
        "number"
      ],
      "description": "When group_col is set, restrict the assessment to this group value."
    },
    "start": {
      "type": "string",
      "description": "Period start (ISO datetime or numeric consistent with the time column)."
    },
    "end": {
      "type": "string",
      "description": "Period end (inclusive)."
    },
    "parameter_cols": {
      "type": "array",
      "items": {
        "type": "string"
      },
      "description": "Pin process-parameter columns; default = all numeric columns."
    },
    "inspection_cols": {
      "type": "array",
      "items": {
        "type": "string"
      },
      "description": "Quality/inspection columns (also used as contribution-analysis targets)."
    },
    "spec_limits": {
      "type": "object",
      "additionalProperties": {
        "type": "object",
        "additionalProperties": false,
        "properties": {
          "lsl": {
            "type": [
              "number",
              "null"
            ]
          },
          "usl": {
            "type": [
              "number",
              "null"
            ]
          },
          "target": {
            "type": [
              "number",
              "null"
            ]
          }
        }
      },
      "description": "Per-parameter spec limits enabling Cpk/Ppk capability findings."
    },
    "weights": {
      "type": "object",
      "additionalProperties": {
        "type": "number",
        "minimum": 0
      },
      "description": "Per-parameter weights for the composite score; default = ontology-role adaptive (quality/inspection signals x2) when available, else equal weights."
    },
    "scenario": {
      "type": "string",
      "maxLength": 120,
      "description": "Free-text scenario of the analyzed system (e.g. production line, energy/HVAC system, lab process). Drives the adaptive narrative subject; inferred from the ontology scene when omitted."
    },
    "objective": {
      "type": "string",
      "maxLength": 300,
      "description": "What the user wants this analysis to answer; surfaced in the report hero as the analysis objective."
    },
    "baseline_path": {
      "type": "string",
      "description": "sentinel watch_baseline.json."
    },
    "action_log": {
      "type": "string",
      "description": "tuning-memory action_log.json; requires a run-dir layout for attribution."
    },
    "doe_run_dir": {
      "type": "string",
      "description": "doe-analyzer run dir whose conclusions/recommendations.json supplies operating windows."
    },
    "preprocessing": {
      "description": "Upstream preprocessing provenance (source export file, script, sha256, summary path) carried verbatim into report.data.preprocessing for the data traceability chain."
    },
    "ontology_path": {
      "type": "string",
      "description": "Explicit ontology.json to adopt (must exist, be valid JSON and carry scene+signals). Overridden by --ontology; when absent the ontology stage prepares a declared prior."
    },
    "scene": {
      "type": "string",
      "maxLength": 120,
      "description": "Scene key for the ontology asset store lookup (same as --scene)."
    },
    "units": {
      "type": "object",
      "additionalProperties": { "type": "string" },
      "description": "Declared per-column units (column -> unit). Declared units are the only units that enter the ontology as user_provided/KNOWN; columns without a declaration stay 'unit undeclared'."
    },
    "ontology": {
      "type": "object",
      "additionalProperties": false,
      "properties": {
        "mode": {
          "enum": ["off", "auto", "full", "reuse", "extend"],
          "description": "Ontology stage mode for scripts/ontology_prepare.py and the analyze-entry brief gate (ONTOLOGY_BRIEF_REQUIRED). Absent/none/off keeps the gate off."
        },
        "scene_key": {
          "type": "string",
          "description": "Scene key override for the ontology asset store (fallback chain: --scene > ontology.scene_key > scenario > run dir name)."
        }
      },
      "description": "Ontology stage directives consumed by scripts/ontology_prepare.py (prepare mode/scene) and by the analyzer's brief gate."
    }
  }
}