{
  "line_id": "DEMO-REACTOR-L1",
  "preprocessing": {
    "mode": "directory_adaptive",
    "source_directory": "D:\\codes\\industrial-deep-diagnostic\\data\\lsr_demo",
    "recursive_discovery": true,
    "report_path": "D:\\codes\\industrial-deep-diagnostic\\workspace\\closedloop\\line_reports\\LSR-20261014023702-suxicp002\\00_input\\preprocessing_report.json",
    "manifest_path": "D:\\codes\\industrial-deep-diagnostic\\workspace\\closedloop\\line_reports\\LSR-20261014023702-suxicp002\\00_input\\input_manifest.json",
    "source_files": [
      {
        "relative_path": "line_demo.csv",
        "sheet": null,
        "role": "primary_time_series",
        "disposition": "selected",
        "reason": "highest-scoring eligible time-series table",
        "rows": 864,
        "columns": 5,
        "time_column": "t",
        "score": 4.864,
        "time_parseability": 1,
        "sha256": "sha256:51e144266bf49fef8f646fb160ba5c99b2ae0acbacb8e1d7ed5d29d09bf6a6ea",
        "size_bytes": 81015
      },
      {
        "relative_path": "ontology.json",
        "role": "metadata",
        "disposition": "context_only",
        "reason": "filename identifies an ontology model; retained as context for semantic wiring, not a scoring table",
        "sha256": "sha256:1b41c14645de2966a191ad89f9b0af3ed95c339b05ed278f58395904503dd936",
        "size_bytes": 2468
      }
    ],
    "selected_table": {
      "file": "line_demo.csv",
      "sheet": null,
      "format": "delimited",
      "n_rows": 864,
      "n_cols": 5,
      "time_column": "t",
      "time_parseability": 1,
      "score": 4.864,
      "why": "highest-scoring time-series candidate (premerged filename gets priority)"
    },
    "merge": {
      "strategy": "single_primary_no_merge",
      "reason": "folder stability mode does not resample or combine different acquisition cadences",
      "merged_files": []
    },
    "merge_exclusions": [],
    "source_dispositions": [
      {
        "relative_path": "line_demo.csv",
        "sheet": null,
        "role": "primary_time_series",
        "disposition": "selected",
        "reason": "highest-scoring eligible time-series table",
        "rows": 864,
        "columns": 5,
        "time_column": "t",
        "score": 4.864,
        "time_parseability": 1
      },
      {
        "relative_path": "ontology.json",
        "role": "metadata",
        "disposition": "context_only",
        "reason": "filename identifies an ontology model; retained as context for semantic wiring, not a scoring table"
      }
    ],
    "context_files": [
      "ontology.json"
    ],
    "skipped_files": [],
    "quality": {
      "rows": 864,
      "cols": 5,
      "time_column": "t",
      "numeric_columns": [
        "reactor_temp",
        "feed_rate",
        "cooling_flow",
        "yield_pct"
      ],
      "missing_cell_pct": 0
    },
    "scoring_table": {
      "path": "D:\\codes\\industrial-deep-diagnostic\\workspace\\closedloop\\line_reports\\LSR-20261014023702-suxicp002\\00_input\\preprocessed_data.csv",
      "sha256": "sha256:5b713e22e18d411ce08e37582a3fc98f3b27f794f2e1998e8214f2dd98c7d566",
      "rows": 864,
      "columns": 5,
      "time_column": "t"
    }
  },
  "data_path": "D:\\codes\\industrial-deep-diagnostic\\workspace\\closedloop\\line_reports\\LSR-20261014023702-suxicp002\\00_input\\preprocessed_data.csv",
  "time_col": "t",
  "ontology_path": "D:\\codes\\industrial-deep-diagnostic\\data\\lsr_demo\\ontology.json"
}